date,text,score_label,score_negative,score_neutral,score_positive,retweetCount,replyCount,likeCount,quoteCount,robertuito_7,robertuito_214,robertuito_231,robertuito_244,robertuito_298,robertuito_311,robertuito_328,robertuito_373,robertuito_551,robertuito_625,robertuito_650
2024-07-29,sigam exemplo do presidente chileno gabriel boric,0.4942832887172699,0.163884624838829,0.3418321311473846,0.4942832887172699,1,0,9,0,0.1845260560512542,0.1285525113344192,1.5096611976623535,-0.1405901312828064,-0.6320707201957703,-0.4812191724777221,-1.1157326698303225,0.0243103615939617,0.8935460448265076,-0.3592350780963897,1.0339083671569824
2024-07-29,proceso electoral venezuela siento obligado moralmente exigir total transparencia dijo presidente chileno gabriel boric info,0.5357790589332581,0.290773332118988,0.5357790589332581,0.1734475791454315,3,0,3,0,0.2501881718635559,-0.4642067551612854,1.1444413661956787,0.2472199499607086,-0.6520072817802429,-0.3901939690113067,-0.8493754267692566,-0.600168764591217,0.2518535256385803,0.2471738159656524,0.7315886616706848
2024-07-29,gabriel boric dice reconocerá nicolas maduro presidente venezuela elección popular reconoce exalta apoya comico asesino propio pueblo zelenski auto impuesto mandato expiró cuanta congruencia,0.5842076539993286,0.5842076539993286,0.3493053317070007,0.0664869621396064,21,1,26,1,-0.0381417348980903,0.1040937602519989,0.9013295769691468,-0.0216558687388896,-0.8093488812446594,-0.3305994868278503,-0.6520000696182251,-0.2923515141010284,0.2586213052272796,0.849203884601593,1.1062973737716677
2024-07-29,presidente do chile gabriel boric nem toda a atas poderiam verificar essa eleio foram entregues sintome moralmente obrigado exigir transparncia total nesta eleio,0.6833862066268921,0.6833862066268921,0.2235881835222244,0.0930256322026252,4,0,21,0,0.0439534485340118,-0.1299817413091659,1.1287002563476562,0.1749988049268722,-0.3434543013572693,0.0478842183947563,-0.3185665607452392,0.1203802600502967,0.8242971897125244,0.1121976152062416,-0.0498778671026229
2024-07-29,difíciles creer dijo presidente chile gabriel boric tras anuncio resultados elecciones venezuela dan nicolás maduro vencedor video cuenta reacciones,0.6333092451095581,0.2242703735828399,0.6333092451095581,0.1424203515052795,22,17,60,2,0.1577807813882827,-0.5353503823280334,1.3463740348815918,0.264354795217514,-0.8076540231704712,-0.5144497156143188,-1.1960117816925049,-0.8616740703582764,0.7797372937202454,0.1206460744142532,1.1192755699157717
2024-07-29,elecciones venezuela cargadas cuestionamientos bancada socialista apoyamos presidente boric reconocer resultados garantías transparencia resguardo democracia compromiso prioridad nunca,0.564471960067749,0.2632232308387756,0.564471960067749,0.1723048388957977,1,1,5,0,0.2749134004116058,-0.1906447410583496,1.1033350229263306,-0.0223223939538002,-0.1294173747301101,-0.3416331708431244,-0.33022341132164,-0.3779811859130859,0.3740421533584595,0.4094705581665039,0.7354130744934082
2024-07-29,régimen maduro debe entender resultados publica difíciles creer gabriel boric tras elecciones venezuela,0.533219575881958,0.533219575881958,0.3840511739253998,0.0827292427420616,36,8,120,0,0.2653112113475799,-0.6604731678962708,1.3884260654449463,0.2722660899162292,-0.771850049495697,-0.2617469131946563,-1.067801594734192,-0.5591622591018677,0.4069706201553345,-0.3201958537101745,1.03903329372406
2024-07-29,siendo presidente fech boric viajó venezuela primeras impresiones,0.8436321020126343,0.087654136121273,0.8436321020126343,0.0687137022614479,173,11,393,5,0.0574130415916442,0.1494804471731186,0.8674052953720093,0.7804845571517944,0.1110395491123199,0.15211221575737,-0.8592028021812439,-0.6249005198478699,0.6563587784767151,0.5500181317329407,0.9822221398353576
2024-07-29,presidente chile gabriel boric pronuncia torno elecciones presidenciales venezuela,0.5348905920982361,0.2670010030269623,0.5348905920982361,0.1981083899736404,4,0,5,1,0.1902080476284027,-0.3464337587356567,1.69774067401886,0.5985097289085388,-0.7060360312461853,-0.4771286249160766,-1.436709761619568,-1.0428625345230105,1.3555693626403809,-0.1153121516108512,0.9142196774482728
2024-07-29,venezuela maduro partido republicano asquerosos,0.862708330154419,0.862708330154419,0.1090666875243187,0.028225028887391,38,5,59,1,-0.2172501385211944,-0.4327398538589477,0.870980978012085,0.422048270702362,-0.4528719484806061,0.3108797371387481,0.2839114069938659,0.1396127492189407,0.5407825112342834,1.1515371799468994,1.226077914237976
2024-07-29,incluso medio afín cercano chileno frente amplio critica gobierno gabriel boric alineamiento fuerzas injerencistas agresivas venezuela junto elon musk mauricio macri javier milei,0.6383531093597412,0.6383531093597412,0.323470264673233,0.0381765477359294,160,37,202,19,0.1214286461472511,0.6894434094429016,1.0093528032302856,0.2394375950098037,-0.2579676806926727,-0.2342923283576965,-0.1953983753919601,-0.1351333558559417,0.5296645760536194,0.3858123421669006,0.7704333662986755
2024-07-29,insólito mismo boric reconoce democracia venezuela resultados electorales monarquía hacer negocios menos pedirá haga elecciones emiratos doble rasero doble cara,0.7060126662254333,0.7060126662254333,0.2659698128700256,0.0280175078660249,4038,555,7519,150,0.4509156942367553,-0.3199201226234436,1.370426058769226,-0.069437175989151,-0.216962844133377,0.1014743223786354,-0.6466869711875916,-0.4144827425479889,-0.2781409621238708,0.5059102773666382,0.9212185740470886
2024-07-29,gabriel boric exige mais transparncia na elees venezuelan sintome moralmente obrigado exigir total transparncia nestas elees,0.4888752698898315,0.4888752698898315,0.3849289715290069,0.1261957585811615,19,2,30,0,-0.0910712257027626,0.1790306568145752,0.6192512512207031,0.2925793528556824,0.0403809808194637,0.0608410835266113,-0.8032178282737732,0.3744390308856964,0.3004467785358429,0.0737644284963607,-0.2414023876190185
2024-07-29,presidente esquerdista do chile gabriel boric declara chile reconhecerá a eleies na venezuela legítimas devido s óbvias fraudes ocorreram nela zoando,0.6672280430793762,0.6672280430793762,0.2439555674791336,0.0888163819909095,5,0,21,0,0.1010787934064865,0.3051474392414093,0.8065957427024841,-0.2716132402420044,-0.555476188659668,0.0752679854631424,-0.5519204139709473,-0.2351430505514145,0.3762848079204559,0.5005932450294495,0.4055477380752563
2024-07-29,parece chistoso presidente boric hable régimen venezuela si chile llamó demócrata violador derechos humanos allana comedores populares reprime pacos movilizaciones niñas lleva años araucania militarizada toma detenido opositores leyes represivas aprobado pacta derecha pinochetista persona podría entender alguien tampoco sabe obtuvo firmas ir elecciones presidenciales,0.8798565864562988,0.8798565864562988,0.1082159578800201,0.0119274128228425,171,64,215,13,0.3533224165439605,0.5496255159378052,1.181699275970459,0.1266167610883712,-0.6354429721832275,-0.2599311470985412,-0.8178257942199707,-0.0566752925515174,0.0276770517230033,0.3339262008666992,1.1741615533828735
2024-07-29,madurono é verde derrotou edmundo gonzález derrotou globo estadofoice d so paulo bolsonaros mileio gabriel boric otan unidos unio europeia gado esperneia,0.4347963631153106,0.392766386270523,0.4347963631153106,0.1724372804164886,2,0,9,0,-0.0558513216674327,0.1293852776288986,0.4080166816711426,-0.0267044585198164,-0.8771670460700989,0.0154211744666099,-0.1583324819803238,0.0364315919578075,0.1391185522079467,0.9086559414863586,0.4359898865222931
2024-07-29,si apoyas fraude maduro puedes gobierno cuyo presidente boric cuestiona resultados si ambiguo comunistas molesta defensa dictaduras criminales lado democracia dictaduras ambas,0.8855628967285156,0.8855628967285156,0.101683385670185,0.0127536617219448,95,3,144,0,0.396753579378128,-0.1922673285007476,1.4700220823287964,-0.065143384039402,-0.8036473393440247,0.1041717305779457,-0.5917006731033325,-0.294098287820816,-0.1968259215354919,0.4614422619342804,0.7891820669174194
2024-07-29,gabriel boric presidente chile emiratos árabes poniendo ejemplo jeque mismo reconocido resultados electorales venezuela,0.6519896984100342,0.1657186597585678,0.6519896984100342,0.1822915971279144,729,421,1536,45,0.0069627165794372,0.1433583199977874,1.670631766319275,0.1633651852607727,-0.2533811926841736,-0.38856241106987,-0.6088957786560059,-0.151170402765274,0.1478147804737091,0.3238287568092346,1.310304045677185
2024-07-29,acuerdo cepa firmamos mañana presidente mohamed bin zayed nahayan primer tratado chile firma país medio oriente abre gran oportunidad comercio aumentar significativamente inversiones emiratos árabes chile,0.5342780351638794,0.0401840135455131,0.5342780351638794,0.4255379438400268,461,361,2943,72,0.2336166799068451,0.3975178003311157,1.0138261318206787,0.0252985153347253,-0.4744943976402282,-0.3065871596336365,-0.4242552816867828,-0.3746055662631988,0.9620214700698853,0.5190155506134033,0.6045526266098022
2024-07-29,hace años agosto diputado gabriel boric condena venezuela nicaragua,0.7195319533348083,0.7195319533348083,0.2439421266317367,0.036525934934616,303,19,1296,15,0.2021145969629287,0.6243936419487,0.8348171710968018,0.3747343719005584,0.0260776877403259,0.3223383128643036,-0.6737257838249207,-0.5663214325904846,0.0688008591532707,0.1948897838592529,1.0543394088745115
2024-07-29,delegación chilenos apoyaron inverosímil reelección maduro lunes defendido victoria descartando denuncias fraude criticaron presidente boric reconocer resultados,0.6938905715942383,0.6938905715942383,0.2672426402568817,0.0388667918741703,113,15,60,10,-0.1172891706228256,0.0065281759016215,1.6100839376449585,-0.0227326713502407,-0.330306202173233,-0.3916780352592468,-0.40882208943367,-0.3481166660785675,0.1684044748544693,0.1180715560913086,0.8059911131858826
2024-07-29,derecho emplazar si toda derecha hecho silencio caso macaya ayer providencia desastre venezolanos tiraste pelota gobierno alcaldesa presidente boric pasquín mierda,0.9450960159301758,0.9450960159301758,0.0486840605735778,0.0062199817039072,0,0,1,0,0.0753734335303306,0.6371363401412964,1.0686488151550293,0.2460682690143585,0.0141963297501206,0.0229384154081344,-0.16277377307415,0.3261453807353973,-0.073224551975727,0.086560420691967,0.7570074796676636
2024-07-29,izquierda peruana llega dedo meñique pie presidente boric discrepo ideológicamente demostrado demócrata cabalidad,0.5584210753440857,0.5584210753440857,0.4048472642898559,0.036731693893671,56,12,368,2,0.5307485461235046,0.94855135679245,1.1291377544403076,0.1828122437000274,0.1612244099378585,-0.6678327322006226,-0.7651327848434448,-0.238515704870224,-0.0228009410202503,-0.1180231943726539,0.7827053070068359
2024-07-29,venezuela responde presidente boric cree mamá tarzan,0.7121514081954956,0.1493957489728927,0.7121514081954956,0.1384528577327728,0,1,0,0,-0.0694321766495704,0.4289414882659912,0.5599181056022644,-0.4546734392642975,-0.660228431224823,-0.5281292200088501,-0.7633602023124695,-0.5050983428955078,0.7698881030082703,0.3238402903079986,0.8805314302444458
2024-07-29,excelente posicionamiento hacer mucha presión internacional transparencia cuenten votos verdad venezuela,0.715732753276825,0.0235346499830484,0.2607325911521911,0.715732753276825,96,38,604,5,0.6159037947654724,-0.5628268122673035,0.7274920344352722,0.5894741415977478,-0.4005639851093292,0.0793224349617958,-0.0762828961014747,-0.478333443403244,0.2742356359958648,1.4573856592178345,0.7552618980407715
2024-07-29,recibimos nueva delegada presidencial provincial antártica constanza calisto gallardo enfermera cuenta magíster salud pública deseamos éxito representando gobierno presidente boric zona austral,0.556891143321991,0.0469132289290428,0.3961956202983856,0.556891143321991,3,0,13,0,0.2170843183994293,-0.0543737560510635,1.4978322982788086,-0.2354066520929336,-0.2674974799156189,-0.7739508152008057,0.3235867917537689,-0.5580740571022034,1.3090612888336182,0.601862907409668,0.9184601902961732
2024-07-29,holis desaprobación gabriel boric aumento,0.6335809230804443,0.0518702492117881,0.6335809230804443,0.3145487606525421,31,1,31,0,0.8711049556732178,1.8648799657821653,1.2879559993743896,0.0150759853422641,0.0719088613986969,-0.7486562728881836,-0.2898022532463074,-0.2988394200801849,0.7239118814468384,0.0799623951315879,1.0804952383041382
2024-07-29,abu dhabis iconic building light up in colour of chilean flag to welcome chilean president gabriel boric font to uae,0.4302549362182617,0.1568037867546081,0.4129413068294525,0.4302549362182617,0,1,4,1,-0.1183866634964943,0.4898099899291992,0.7121132016181946,0.0234230514615774,-0.4169218242168426,-0.149914875626564,-0.3221911787986755,-0.0457761548459529,0.6609440445899963,0.2996184825897217,0.8027138710021973
2024-07-29,vergüenza presidente boric removió delegación diplomática venezolana país espero incluya delegación militar venezolana presente chile deben irse,0.9028711915016174,0.9028711915016174,0.085889808833599,0.0112389912828803,73,5,125,0,0.3199082314968109,-0.1624414771795272,1.47687566280365,0.3660941123962402,-0.1340269595384597,-0.0027601609472185,0.0780013874173164,-0.3324927091598511,1.0129520893096924,1.1249045133590698,0.9299388527870178
2024-07-29,máxima tensión venezuela hablamos jorge faurie embajador argentino chile presidente gabriel boric indicó reconocerán ningún resultado verificable seguí,0.5221008062362671,0.4391174614429474,0.5221008062362671,0.0387817621231079,9,1,20,0,0.1748459488153457,-0.3393423855304718,1.2280499935150146,0.1622672975063324,-0.4733720421791076,-0.0646576285362243,-0.0769479945302009,-0.8653950691223145,0.6601914763450623,0.2709225714206695,0.9910433888435364
2024-07-29,highlight of chilean president gabriel boric font visit to sheikh zayed grand mosque in abu dhabi,0.4705239236354828,0.1407874375581741,0.4705239236354828,0.3886885941028595,0,1,0,0,-0.5602810978889465,0.9236227869987488,0.5811362862586975,0.1599380224943161,0.1091210320591926,-0.2200250923633575,-0.1477627903223037,0.3146732747554779,0.8512445092201233,0.0244923569262027,0.6003352403640747
2024-07-29,declararon presidente electo ayudo guion hagan juramentación parquecito pobre guaidó hagan twitch vivo laje anima boric abinader milei zelensky musk haciendo react nunca vista,0.7559543251991272,0.178537368774414,0.7559543251991272,0.0655082985758781,9,17,22,6,-0.1985824108123779,0.3589713871479034,0.8210779428482056,0.1042938604950904,-0.7399347424507141,-0.0935556292533874,-0.3065491914749145,-0.2981726229190826,0.5061540007591248,0.8043150901794434,0.7673875093460083
2024-07-29,mierdas comunistas sacarlas gobierno perpetuen poder hacen dictaduras comunistas marxistas camila vallejo giorgio jackson karol cariola gabriel boric escorias miserables caracas karina oliva,0.9031915068626404,0.9031915068626404,0.0836976319551467,0.013110814616084,114,16,180,1,-0.1492501497268676,0.7755305171012878,0.8962092399597168,0.6955527663230896,-0.0773777663707733,0.0362043976783752,-0.2538208961486816,0.3069337904453277,0.6026820540428162,-0.10221678763628,1.1382741928100586
2024-07-29,notable senador oficialista podemos acuerdo frontal directo emplazamiento fiscal nacional ángel valencia percepción transversal valencia dilatando formalización hermosilla,0.5115774273872375,0.442151129245758,0.5115774273872375,0.046271476894617,736,15,1150,15,0.1559650152921676,1.100880146026611,0.966130554676056,0.1502525061368942,-0.0194655582308769,-0.0890029668807983,-0.17658132314682,-0.5771169066429138,0.0067168860696256,0.0140385152772068,0.5286397337913513
2024-07-29,farsante luchador gabriel boric reconoció dictadora asesina dina boluarte después usurpar cargo presidencial haber matado peruanos herido reconoce democracia emiratos árabes unidos llamó injusto reclamos piñera,0.8676079511642456,0.8676079511642456,0.1052387654781341,0.0271533150225877,1,0,1,1,0.047726884484291,0.771278977394104,1.2392592430114746,0.0625408813357353,-0.3779995739459991,-0.4653375446796417,-0.4182172119617462,-0.2370079308748245,0.2658312022686004,0.5612484812736511,0.6571400761604309
2024-07-29,kast permanentemente preocupado venezuela chile pide presidente boric acuda oea vieron emplazando sector tomar medidas abusador macaya,0.8947910666465759,0.8947910666465759,0.0957193374633789,0.0094895670190453,165,33,310,4,0.1319970190525055,-0.0501581467688083,1.2114838361740112,0.1270595043897628,-0.4548210799694061,0.3523150980472564,-0.6498264670372009,-0.4965516626834869,0.4072696566581726,0.078380636870861,0.4416255354881286
2024-07-29,gracias boric cualquier país bananero ríe,0.4834895133972168,0.3049821257591247,0.4834895133972168,0.2115283459424972,0,0,0,0,-0.1056737080216407,0.6692612171173096,0.4628154039382934,0.0934840217232704,-0.0575754232704639,-0.3739935457706451,-1.080032229423523,-0.3437867164611816,-0.4312891662120819,1.5330212116241455,0.3188656270503998
2024-07-29,frente fraude maduro abismo silencio cómplice colombia petro posición firme rechazo chile boric dictadores izquierda derecha sátrapas origen camuflaje maduro caerá,0.8319799900054932,0.8319799900054932,0.142220139503479,0.0257998723536729,39,5,184,1,0.4125441014766693,0.0675683990120887,0.5545793771743774,0.0393197312951087,-0.6379743218421936,-0.2630918323993683,-0.5529835820198059,-0.0704118087887764,-0.1218009144067764,0.0938867032527923,0.8034519553184509
2024-07-29,estupido dia asumioo nuestroexpextacular mejor presidente tenidogabriel boricde punta arenasa pesar loque ud amenaza si parece bien guebonesboric igual cumplido gran partede programalo culpa derecha pedofilicos,0.9209918975830078,0.9209918975830078,0.0670072585344314,0.0120008122175931,5,0,6,0,-0.0616704374551773,0.5444183349609375,0.7038589715957642,-0.0772351622581482,-0.5818161964416504,-0.0394037812948226,-0.207472950220108,0.077133223414421,0.6841250061988831,0.8668144941329956,0.3470573723316192
2024-07-29,hablan maduro votaron lula petro boric sanchez,0.5578404068946838,0.3392782807350158,0.5578404068946838,0.1028812676668167,0,0,0,0,-0.1395905911922454,-0.8849170207977295,1.3963721990585327,0.2695339918136596,-1.1520609855651855,0.1471636444330215,-0.8473146557807922,-0.1071116030216217,0.3605047762393951,0.6675204038619995,1.291585087776184
2024-07-29,cada chilenos cree debe abandonar senado demanda salida transversal espectro político debido repudiable defensa favor padre intento desacreditación víctimas menores edad,0.8973522186279297,0.8973522186279297,0.0932830944657325,0.0093646608293056,817,29,1399,14,0.4021872878074646,0.2177306115627288,0.6935955286026001,0.1616040766239166,-0.1739035546779632,-0.2000448256731033,-0.467460036277771,-0.2865543365478515,0.512646496295929,0.4526695013046264,0.559343695640564
2024-07-29,boric sendo corajoso ao denunciar ditadura tem pressionar mesmo,0.540429413318634,0.540429413318634,0.2063410133123397,0.253229558467865,1,0,6,0,-0.2038198709487915,0.3249081969261169,0.582983136177063,-0.6928686499595642,0.1222870051860809,0.2493962943553924,-0.6785523891448975,0.036972090601921,-0.5095704793930054,0.5969716310501099,-0.0769110471010208
2024-07-29,legados boric n plurinacionalismo tratado imponer farsa igual pueblo originarios si hacemos adn chilenos descubriremos nadie sangre sola raza etnia gracias boric favor concedido,0.6426223516464233,0.6426223516464233,0.3232983648777008,0.0340792872011661,0,0,0,0,0.3997902274131775,0.4610080122947693,0.9279353618621826,0.3122550845146179,-0.0523496232926845,-0.1675498634576797,-0.1905652582645416,0.3714247643947601,0.4309464991092682,0.642127275466919,0.9723108410835266
2024-07-29,apoyan matams tributando milei boric compañia sumarse plan violencia preparada oposición extremista tras derrota primera ocurre mismo modus operandi,0.8154895305633545,0.8154895305633545,0.1711363494396209,0.0133741227909922,1633,159,2232,65,0.3215898275375366,0.4989803433418274,1.055614709854126,-0.0405327938497066,-0.4977526068687439,0.0305758100003004,-0.432077944278717,-0.4578894376754761,0.875201404094696,0.5402092337608337,0.9821946620941162
2024-07-29,lunes defendido victoria descartando denuncias fraude criticaron presidente gabriel boric reconocer resultados,0.5162479281425476,0.5162479281425476,0.4061415195465088,0.0776106268167495,18,5,17,1,0.0806575790047645,-0.0565807148814201,1.8088645935058596,0.1121017783880233,-0.0332213416695594,-0.3854954242706299,-0.5723792314529419,-0.544528603553772,0.2377654761075973,-0.1037008538842201,0.5667403936386108
2024-07-29,chile emiratos firman histórico acuerdo abre nueva ventana dijo presidente boric,0.4649654924869537,0.0817698910832405,0.4649654924869537,0.4532646238803863,16,4,253,1,0.249830886721611,-0.3146250247955322,1.3465981483459473,-0.0153091577813029,-0.8432193994522095,-0.8274075388908386,-0.4092883467674255,-0.5292859077453613,0.884247362613678,0.7893098592758179,0.7614217400550842
2024-07-29,declaración presidente boric tras triunfo maduro preocupa afianzar relaciones esperado reconociera resultados,0.5352125763893127,0.1981164962053299,0.5352125763893127,0.2666709125041961,0,3,0,0,0.5692534446716309,-0.5027087926864624,1.6848843097686768,0.0044456245377659,-0.2059343457221985,-0.6570477485656738,-0.7317244410514832,-0.8555101752281189,0.5880332589149475,0.4900131225585937,0.4463499188423157
2024-07-29,usted weón cree boric mano pc irse vía democrática ja,0.6049900650978088,0.6049900650978088,0.3564196228981018,0.0385903380811214,1,0,7,0,-0.0432719625532627,0.8093255162239075,0.7941912412643433,-0.1159806177020073,-0.4691268503665924,0.0862330496311187,-1.4078576564788818,-0.5980159044265747,0.2697001993656158,0.2172206342220306,1.0775738954544067
2024-07-29,presidente boric maneja pc antojo digas huevadas,0.6865375638008118,0.6865375638008118,0.2618487775325775,0.0516136586666107,3,0,6,0,-0.093421921133995,0.2147934138774871,1.2854220867156982,0.0499374121427536,-0.4554446339607239,-0.5756131410598755,-0.6880223155021667,0.036642737686634,0.6308499574661255,0.9354583621025084,1.2030998468399048
2024-07-29,asombran pc toda ultra izquierda chilena incluido fa si igual carnicero stalin piensan última hora chile diosdado edmundo gonzalez nicolas maduro boric,0.7558465600013733,0.7558465600013733,0.215411826968193,0.0287416446954011,2,4,3,0,-0.0192517638206481,0.1226881593465805,0.9307746887207032,0.3399207890033722,-0.3328834176063537,0.1539672166109085,-0.4527934491634369,0.4166124761104584,0.3227797150611877,-0.1778101921081543,1.0043962001800537
2024-07-29,boric completa cartel fascista,0.8968008756637573,0.8968008756637573,0.0831108316779136,0.0200884100049734,0,0,0,0,-0.4939130246639251,0.4403270184993744,1.2888914346694946,0.2033021003007888,0.422214150428772,-0.0976142957806587,-0.129348799586296,0.5520080327987671,0.6070337295532227,0.6673216819763184,0.5206273198127747
2024-07-29,simple claro venezuela permita verificación actas veedores internacionales básico cualquier elección democrática mundo chile reconocerá resultado enviará felicitaciones,0.689373791217804,0.036122515797615,0.689373791217804,0.2745036482810974,94,9,341,1,0.3865192830562591,-0.3486837446689605,1.1884957551956177,0.0951091274619102,-1.0715159177780151,0.1309686154127121,-1.1005395650863647,-0.6266968250274658,0.4316988289356231,0.997568130493164,0.6643604636192322
2024-07-29,boric fascista oro imperialismo yanqui,0.8294037580490112,0.8294037580490112,0.1472610235214233,0.0233352407813072,0,0,0,0,-0.0571104288101196,0.9402294158935548,1.3945112228393557,-0.1774116456508636,-0.5328831076622009,-0.1052440106868743,-0.1111017763614654,0.2037491053342819,-0.4972141087055206,0.7839459180831909,0.8839560151100159
2024-07-29,boric digno moralmente,0.4394592046737671,0.2703326344490051,0.4394592046737671,0.2902081310749054,2,0,7,0,-1.221421480178833,1.1515710353851318,1.6339008808135986,-0.178989753127098,0.3321067690849304,0.5158032178878784,-0.5915549993515015,-0.029450574889779,0.2589086890220642,0.1553344428539276,-0.1507272720336914
2024-07-29,boric demócratas emiratos árabes,0.6953397393226624,0.1784538477659225,0.6953397393226624,0.1262063384056091,0,0,0,0,-0.1961955577135086,0.3498018085956573,1.5616743564605713,-0.4439117014408111,-0.5495970845222473,-0.1400831341743469,0.1511017680168151,0.5727561116218567,0.3112331628799438,1.8489537239074707,0.4791088104248047
2024-07-29,javier milei nicolás maduro benjamín netanyahu gabriel boric donald trump kamala harris lula da silva etc soretes diferentes olores repugnancia toma posturas dicen soretes independencia digan boludos,0.9224263429641724,0.9224263429641724,0.0664006546139717,0.0111729819327592,11,2,32,0,0.157860979437828,0.4986937642097473,0.5676772594451904,0.5701573491096497,0.0292435344308614,0.6388030052185059,0.0122727872803807,0.3501845300197601,0.7484084367752075,0.2153273373842239,0.6523603200912476
2024-07-29,podrido sistema venezolano parece democrático boric querido bajo constitución chavista delirante dijimos rechazo,0.9128682017326356,0.9128682017326356,0.0754477456212043,0.0116839883849024,6,0,9,0,0.1522333323955536,-0.12642802298069,0.8732268214225769,0.0284797102212905,-1.2787662744522097,0.270918607711792,-0.766910195350647,-0.1586869359016418,0.1333077996969223,1.1843111515045166,0.726861834526062
2024-07-29,boric pedir nadapero simple elecciones nunca ma votar comunistas fraude amplio,0.6254122853279114,0.6254122853279114,0.3331375420093536,0.0414501763880252,2,0,3,0,-0.0106770247220993,0.4676092267036438,0.6157885193824768,0.312033861875534,-0.311690479516983,-0.2195693701505661,-0.2248746901750564,-0.0256856214255094,0.988861918449402,1.3032190799713137,0.4355530738830566
