date,text,score_label,score_negative,score_neutral,score_positive,retweetCount,replyCount,likeCount,quoteCount,robertuito_7,robertuito_214,robertuito_231,robertuito_244,robertuito_298,robertuito_311,robertuito_328,robertuito_373,robertuito_551,robertuito_625,robertuito_650
2022-12-25,advirtió toda formas hicieron caso boric presentó masivo plan socialización economía brutal suba impuestos estatización jubilaciones,0.5424241423606873,0.3726674020290375,0.5424241423606873,0.0849084109067916,210,23,317,15,0.8111646771430969,1.096600890159607,0.659447968006134,0.3342116773128509,-0.1516996324062347,-0.7879727482795715,-0.465323269367218,-0.5759509801864624,0.1104416698217392,-0.1906700134277343,1.337498664855957
2022-12-25,gabriel boric ir venir primer correr tiempo presidente dejar atrás idea matrix apuesta política adaptarse imposiciones realidad,0.6274516582489014,0.2647577226161957,0.6274516582489014,0.1077906191349029,2,16,19,1,0.8341219425201416,0.1053389385342598,1.281578540802002,0.2310781478881836,0.1492791622877121,-0.5860913991928101,-0.9288007616996764,-1.152803659439087,0.4207179248332977,-0.0141470218077301,1.120615839958191
2022-12-25,gabriel boric gobernar si realizar transformaciones distribución riqueza poder dfmas pido senado responsabilidad respecto tema f nacional logremos tomar decisiones n conjunto,0.6780950427055359,0.1261839717626571,0.6780950427055359,0.1957209855318069,4,0,12,0,1.100401759147644,-0.0776558294892311,0.8497479557991028,0.4405839443206787,0.2013249695301056,-0.6443297863006592,-0.5394472479820251,-0.31671804189682,0.9654001593589784,0.7008084654808044,0.724742591381073
2022-12-25,insisto horas incendios forestales zona aledañas tomas ilegales delincuentes estan tomando terrenos tomas incendiadas boric giorgio jackson,0.922826647758484,0.922826647758484,0.065462626516819,0.0117107145488262,20,2,19,0,0.170966699719429,0.6465219259262085,1.0747566223144531,0.3563501834869385,-0.1325097978115081,0.3432073593139648,-0.1625061482191085,0.2749233543872833,0.6112458109855652,-0.6426019072532654,0.2939268052577972
2022-12-25,presidente boric dice congreso impuesto lógica individualista tras fallidas nominaciones moneda fiscal nacional,0.8084948658943176,0.8084948658943176,0.1718567013740539,0.0196484066545963,5,17,98,1,0.4136569499969482,0.8894888162612915,1.0634952783584597,0.1715943068265915,-0.2333983331918716,-0.4840923249721527,-0.7640106081962585,-0.1622723340988159,0.2167436927556991,-0.0938785970211029,0.7583608031272888
2022-12-25,esencia democracia poderes conversen buscar soluciones conflictos existentes entonces diálogo establecido pdte república pdte corte suprema,0.746841549873352,0.0932589098811149,0.746841549873352,0.1598994731903076,52,247,191,32,0.1601049900054931,-0.0708541646599769,1.1463285684585571,0.3431998193264007,-0.4431297779083252,-0.6324163675308228,-0.6814669966697693,0.1060373783111572,0.3391096889972687,0.878295361995697,0.9607370495796204
2022-12-25,gabriel boric evaluó gestión nueve meses asumir presidencia mandó fuerte mensaje senado,0.6349276900291443,0.1760802865028381,0.6349276900291443,0.1889920532703399,0,0,2,0,0.1895830333232879,-0.5053555369377136,1.8709580898284912,0.1398711502552032,0.146051824092865,-0.5048552751541138,-0.576391339302063,-1.0407861471176147,0.7628215551376343,-0.6198346018791199,0.7443256974220276
2022-12-25,presidente boric manos limpias alcaldesa viña maca ripamonti manos limpias alcaldesa santiago irací hassler manos limpias ninguno prontuario lleno delincuentes tupé hablar izquierda,0.4449140429496765,0.4306628406047821,0.4449140429496765,0.1244230791926384,185,21,307,6,0.1459539979696273,0.6663302183151245,0.6412433981895447,0.2790421843528747,0.1922610849142074,-0.6341700553894043,-0.0597217679023742,0.3489573001861572,0.7798910140991211,-0.3241086006164551,0.6526556015014648
2022-12-25,presidente boric pidió responsabilidad senado tras fallidas nominaciones fiscalía nacional,0.5175533890724182,0.5175533890724182,0.4248681664466858,0.0575784333050251,13,53,94,6,0.0420761480927467,0.2048723399639129,1.3171223402023315,0.4211375117301941,0.1344567984342575,-0.1902291029691696,-0.5419118404388428,-0.4374668300151825,0.6570953130722046,-0.4329729676246643,0.4826890230178833
2022-12-25,piden parisi pagar pensión alimentos nadie pide boric devolver meses dieta parlamentaria cobró hacía campaña presidencial,0.5908175706863403,0.5908175706863403,0.3613424599170685,0.0478400327265262,467,10,972,4,0.3054006397724151,0.5905767679214478,1.5274807214736938,0.2043901830911636,0.5419924855232239,-0.3622651696205139,-0.2699352502822876,-0.4044766128063202,0.6395872831344604,-0.5377486944198608,0.9184390306472778
2022-12-25,sigue alza desaprobación boric cercano máximos llega,0.6013742089271545,0.6013742089271545,0.3486405313014984,0.0499852113425731,344,14,976,19,0.2641403675079345,0.5381084680557251,1.7780210971832275,-0.2580725252628326,0.2264851778745651,-0.5095713138580322,-0.8788665533065796,-0.6223213076591492,0.2282546460628509,0.94876891374588,0.7345293164253235
2022-12-25,encuesta aprobación presidencial gabriel boric font desapruebo apruebo,0.5785009860992432,0.3306794464588165,0.5785009860992432,0.0908195823431015,98,8,218,0,-0.2474546581506729,0.0783178806304931,1.4143766164779663,-0.0086592193692922,-0.4100721776485443,-0.207742765545845,-0.7088452577590942,-0.0362048223614692,1.2138948440551758,-0.1347674578428268,0.7243250608444214
2022-12-25,aprobación presidente boric mantiene estable nivel confianza cae pt respecto septiembre llega,0.6823773384094238,0.1460988223552703,0.6823773384094238,0.1715237945318222,149,64,247,19,0.5653685331344604,-0.1495486944913864,1.86870551109314,-0.2888386249542236,-0.24624665081501,-0.7539507746696472,-1.3066699504852295,-0.5328546166419983,0.4063138961791992,0.0532174296677112,0.8722089529037476
2022-12-25,última encuesta cadem entrega desaprobación gabriel boric sólo aprobación,0.4834735691547394,0.4743135869503021,0.4834735691547394,0.0422127954661846,1,16,4,0,0.0997182354331016,0.6490327715873718,1.3420906066894531,-0.0660111233592033,-0.0964738056063652,-0.4274632930755615,-1.1198900938034058,-0.0147505952045321,1.0590251684188845,-0.6244820952415466,0.6770756244659424
2022-12-25,cadem nivel confianza presidente boric baja delincuencia noticias relevantes,0.6514196395874023,0.2645195424556732,0.6514196395874023,0.0840608030557632,475,168,873,34,0.2801159620285034,0.2876778244972229,1.3485815525054932,0.0918894335627555,-0.3447839319705963,-0.477479487657547,-1.012696623802185,0.0389663353562355,0.910946786403656,-0.09700758010149,0.3648937344551086
2022-12-25,encuesta aprobación presidencial cae picada desaprobación aprobación,0.5108035802841187,0.5108035802841187,0.4320379197597503,0.0571585446596145,348,58,571,12,0.0386493653059005,0.1584023386240005,1.4924695491790771,0.2818168401718139,-0.0597973614931106,-0.3605466187000274,-1.3649883270263672,-0.3804821968078613,0.6110178828239441,-0.4499648511409759,0.5453938245773315
2022-12-25,boric cierra chilenos rechazando gestión apenas aprueba gestión decirlo histórico,0.7473751902580261,0.7473751902580261,0.2090847939252853,0.0435400158166885,19,0,31,2,0.3360064327716827,-0.2634184956550598,1.839779496192932,-0.1823196560144424,-0.3272631764411926,-0.2777093052864074,-0.7310877442359924,-0.2364758402109146,0.6347955465316772,-0.0416024103760719,0.5697752833366394
2022-12-25,chilenos confían boric demoledor,0.7894509434700012,0.7894509434700012,0.17401684820652,0.0365322567522525,5,0,6,0,-0.4213334321975708,-0.1291097849607467,1.310649871826172,0.0002721680502872,-1.0416637659072876,-0.254768431186676,0.0816218480467796,0.0355154834687709,0.3394921422004699,0.5761587619781494,0.0363969467580318
2022-12-25,confirmo escala odios boric puntea,0.7342908978462219,0.7342908978462219,0.2261005491018295,0.0396086126565933,2,7,22,0,0.1809824556112289,0.6937633752822876,1.3360296487808228,-0.1378827840089798,0.0124070281162858,-1.1168066263198853,-0.8217610716819763,0.2626117467880249,0.7658960819244385,1.9054796695709229,-0.1877097934484481
2022-12-25,desaprobación inútil gabriel boric sigue creciendo empina espíritu navideño ayudó última,0.9538061618804932,0.9538061618804932,0.0393572077155113,0.0068365447223186,86,7,168,2,0.0282602719962596,0.5234103798866272,1.7351901531219482,0.1003423407673835,-0.2324179857969284,-0.536853015422821,-0.5027902126312256,-0.0226002931594848,0.2896901071071625,-0.3651039600372314,0.4457345604896545
2022-12-25,encuesta cadem respecto gabriel boric conduciendo gobierno aprobación desaprobación sabeno responde encuesta divulgada domingo diciembre,0.6112686395645142,0.3013452589511871,0.6112686395645142,0.0873860716819763,28,0,28,2,-0.0860332772135734,0.356745183467865,1.1467747688293457,-0.0731138736009597,-0.2374688386917114,-0.4343908429145813,-0.7286267280578613,0.2882031202316284,0.8516831398010254,-0.6074106097221375,0.7666122913360596
2022-12-25,encuesta genus confianza presidente boric si mayor dato boric llegó gobierno,0.7896074056625366,0.1274408251047134,0.7896074056625366,0.0829518213868141,116,4,214,5,0.3063051402568817,0.0894899293780326,1.144762635231018,-0.043479137122631,-0.2477945536375045,-0.8473125696182251,-0.9728721976280212,-0.4119288623332977,1.1093323230743408,0.0617772042751312,0.8481444120407104
2022-12-25,datos cadem desaprobación boric sigue puntos aumenta desacuerdo necesidad nueva constitución comisión expertos debería integrada académicos abogados economistas jackson grau vallejos peor evaluados,0.8452174067497253,0.8452174067497253,0.1397351026535034,0.0150474878028035,1,0,5,1,0.064290352165699,0.6705899834632874,1.0728343725204468,0.2043304294347763,-0.5213850140571594,-0.2311463952064514,-0.6270558834075928,0.090450219810009,0.6376324892044067,-0.1443975418806076,0.7934750914573669
2022-12-25,video partieron estan,0.4316344261169433,0.4172028601169586,0.4316344261169433,0.1511626243591308,3,3,20,0,-0.1808592230081558,0.8688588738441467,1.373671531677246,0.4186053276062011,1.7078183889389038,-0.1464748829603195,0.2809045612812042,0.2589700520038605,-0.1160041615366935,0.8908293843269348,0.5164532661437988
2022-12-25,funó pizza presidente boric,0.561420202255249,0.561420202255249,0.4014405310153961,0.0371392220258712,0,0,0,0,-0.1525267362594604,0.7960337400436401,1.9000959396362305,0.1231963261961937,0.1958888471126556,-0.4459486603736877,0.1154403313994407,-0.0579180791974067,0.2992399036884308,-0.1975034475326538,0.1721610724925995
2022-12-25,nueva alza desaprobación pdte gabriel boric llega,0.5312853455543518,0.332236111164093,0.5312853455543518,0.1364784985780716,3,0,4,0,0.7217519283294678,0.2703493535518646,1.492478847503662,-0.1884747296571731,0.1316419839859008,-0.8329063057899475,-1.03272545337677,-1.1740697622299194,1.0722957849502563,-0.3133498430252075,1.0400843620300293
2022-12-25,ano do fim da unio soviética há ano em dezembro mikhail gorbachev renunciava presidncia da unio soviética levando ao fim do primeiro socialista do mundo nascido em com vitória da revoluo,0.4822166562080383,0.4822166562080383,0.4029369354248047,0.1148463860154151,157,22,1374,43,-0.1602746844291687,0.2378374636173248,0.8037415146827698,0.3703984022140503,-0.1026747301220893,0.487639844417572,-0.4672986268997192,-0.139131873846054,0.2469871193170547,0.5117994546890259,0.481576919555664
2022-12-25,boric chile conce ministra salud diablo laja ffaa pnp bomberos podré angelito cristiano ronaldo putin buenaventura giorgio jackson,0.6619462370872498,0.2477625012397766,0.6619462370872498,0.0902912244200706,9,0,15,2,0.0253626648336648,0.1028569042682647,1.355979323387146,0.4032707214355469,0.1176083162426948,0.0184440612792968,-0.0897608399391174,0.5380108952522278,0.1245656535029411,0.3362196385860443,0.6384375691413879
2022-12-25,diciembre boric alcanza desaprobación consolida desencanto,0.8120790719985962,0.8120790719985962,0.1739869117736816,0.0139339882880449,44,1,88,0,-0.7515698075294495,0.4376257956027984,0.8092066645622253,-0.6273981332778931,0.0706513449549675,-0.5886645913124084,-0.1255740523338318,-0.5230981707572937,0.1396406590938568,1.1696163415908811,0.1249086633324623
2022-12-25,cadem aprobación boric desaprobación boric partir enero pagamos iva servicios luego alza pasajes locomoción chile digno inclusivo paritario,0.4919865131378174,0.4244330823421478,0.4919865131378174,0.0835803672671318,323,22,477,6,0.4462734162807464,0.1259526163339615,1.0438557863235474,-0.1240366846323013,0.011813785880804,-0.9122165441513062,-1.0789849758148191,-0.3019309341907501,1.2602722644805908,0.1152506470680236,1.0715852975845337
2023-09-01,abogado liberal da lección filosófica magdalena derecha respecto caras mérito explicación decia obvio evidente apenas comprendía muestra ultraderecha conservadora basa ideología meme rrss,0.5409785509109497,0.5409785509109497,0.4209699332714081,0.0380515083670616,1428,137,2888,91,0.493923008441925,0.9409454464912416,1.2784812450408936,-0.0435903631150722,-0.3624915480613708,-0.7329794764518738,-0.6839526891708374,-0.2029182463884353,0.4919358789920807,0.5259741544723511,0.8677197098731995
2023-09-01,vamos toda fuerzas historia querido compañero presidente gabriel boric si derecha ladra usted maestro gobierno lujo,0.4432921409606933,0.2048630267381668,0.4432921409606933,0.351844847202301,30,1,64,2,0.8165783882141113,-0.1906247287988662,1.195812463760376,0.2735503017902374,-0.2370871305465698,-0.361550897359848,-0.3910570442676544,-0.682833194732666,0.8670350313186646,0.4159436225891113,0.8928497433662415
2023-09-01,podrían terminar presos contraloría general república emitió lapidario informe comprobó corrupción desatada gobierno gabriel boric,0.8422446846961975,0.8422446846961975,0.1369926631450653,0.0207626521587371,1879,289,2837,78,-0.0915860533714294,0.1649850308895111,1.117835283279419,0.4846895039081573,-0.3895213901996612,-0.2053495496511459,0.0716913864016532,0.3222822844982147,0.0831200927495956,-0.1177519336342811,0.3926555812358856
2023-09-01,gabriel boric font presidente república presente mayor consideración abajo firmantes dirigimos respetuosamente usted manifestamos,0.6960280537605286,0.1933325231075287,0.6960280537605286,0.1106394231319427,10,0,10,0,0.2671894133090973,-0.190794825553894,0.7628858685493469,0.3255069255828857,-0.2813977897167206,0.1698475331068039,-0.4803329408168793,-0.5230922698974609,1.6920989751815796,0.4902832806110382,0.6617424488067627
2023-09-01,gabriel boric juez presidente madurez callar pide dialogo oposicion provoca palabras critica sergio onofre jarpa general suicida trata cobarde decreta duelo muerte terrorista,0.8428897261619568,0.8428897261619568,0.1401632726192474,0.0169469881802797,6,1,5,0,0.1041093319654464,0.1433718651533126,1.2093836069107056,-0.0370823852717876,-0.3310258388519287,0.0289294458925724,-0.4400097727775574,0.5033978223800659,-0.0699623301625251,0.079972930252552,0.3756873309612274
2023-09-01,mismo sector político presidente reconocer ciertas cosas si razón ciertos sectores izquierda si quisieron derrocarlo polarización realizada presidente boric etc,0.6324954032897949,0.6324954032897949,0.3418289422988891,0.0256756283342838,13,2,33,0,0.2724965810775757,0.2288718670606613,1.236350655555725,0.6316364407539368,0.2484044581651687,-0.5336166620254517,-0.699584424495697,-0.3686869144439697,0.3854804933071136,0.4340800344944,0.7842870950698853
2023-09-01,presidente gabriel boric grande,0.7894384860992432,0.032802015542984,0.1777594685554504,0.7894384860992432,3,3,12,0,-0.1194547191262245,-0.0156512465327978,2.203690528869629,0.4382750988006592,0.915313184261322,-0.4244017601013183,-0.3068703413009643,-0.3809988498687744,1.1412266492843628,0.3908665478229522,0.6371304392814636
2023-09-01,recuerdos allá gabriel boric diputado distrito pocos respondió correo empecé buscar apoyo autoridades integración transporte público integrado red,0.8039760589599609,0.1356308907270431,0.8039760589599609,0.0603930689394474,3,0,31,0,0.3381386399269104,0.4254351258277893,1.2980806827545166,-0.1304556131362915,-0.1067029163241386,-0.0433568842709064,-0.349307656288147,-0.2447550594806671,1.1770809888839722,0.1014967784285545,0.8450442552566528
2023-09-01,presidenta presidente boric quería michelle bachelet mira capítulo completo aquí,0.5790536403656006,0.1389797329902649,0.5790536403656006,0.2819666564464569,236,155,1149,91,0.3541185557842254,-0.6334014534950256,1.18455970287323,-0.2005062848329544,-0.2786464691162109,-0.9717668890953064,-1.1409344673156738,-0.5588140487670898,1.344121336936951,0.5246744155883789,1.2822073698043823
2023-09-01,presidente boric años golpe ambiente eléctrico,0.6757760643959045,0.6757760643959045,0.2763359248638153,0.0478879958391189,2,11,17,3,0.5589520931243896,0.3637707233428955,2.026810884475708,0.2215662151575088,-0.1563728749752044,-0.7777847051620483,-0.8831815719604492,-1.3372626304626465,0.5489885807037354,0.6244853138923645,0.3328039348125458
2023-09-01,chilenos agotados lengua afuera último límite producto constantes convulsiones presidente boric primero agrede luego cara llama diálogo generar acuerdos tónica tener país irritado crispado polarizado,0.9564048647880554,0.9564048647880554,0.039114911109209,0.0044801901094615,34,5,27,2,0.2704722881317138,0.4748859405517578,0.9721704721450806,0.1001493409276008,-0.5587709546089172,-0.3137884140014648,-0.2770639061927795,-0.3607367575168609,0.228902131319046,0.1496402770280838,0.9162521362304688
2023-09-01,gabriel boric septiembre,0.5669283866882324,0.1060889512300491,0.5669283866882324,0.326982706785202,8,3,13,0,0.0915275737643241,0.6186347007751465,1.740391969680786,0.0832823142409324,0.9101382493972778,-0.1613622307777404,-0.4538968205451965,-0.491969883441925,0.641602635383606,-0.5754550695419312,0.4668411612510681
2023-09-01,miguel uribe propone alianza sacar gustavo bolívar segunda vuelta elecciones alcaldía bogotá,0.6919233798980713,0.071828082203865,0.6919233798980713,0.2362484484910965,435,285,1677,32,0.1134246662259101,0.6421409845352173,0.7030348777770996,0.4107487499713897,-0.1624894887208938,-0.2282943278551101,-1.1685116291046145,-1.2229853868484497,0.9671746492385864,-0.2850482761859894,0.8793573379516602
2023-09-01,opinión daniel mansuy cuestiona admiración matices manifestado presidente boric respecto carrera política guillermo teillier,0.556517481803894,0.556517481803894,0.3934729695320129,0.0500095710158348,90,145,213,81,0.1803672313690185,0.5861621499061584,1.2025492191314695,0.2817625999450683,-0.0645029321312904,-0.2560948431491852,-0.4754559099674225,-0.0626654550433158,0.6771641373634338,-0.2396054714918136,0.721525251865387
2023-09-01,generando condiciones conmemoración violenta compleja kast arremete presidente boric,0.887048065662384,0.887048065662384,0.1027315780520439,0.0102202827110886,285,210,965,22,-0.162846490740776,0.7821928262710571,1.4717026948928833,0.1741212457418441,-0.4914948642253876,-0.1554435789585113,-0.5833067893981934,-0.324723333120346,0.5674548149108887,-0.0836937576532363,0.928801655769348
2023-09-01,jaime bayly parece verdaderamente horrible repugnante hecho gabriel boric parece extraviado moralmente,0.9720914959907532,0.9720914959907532,0.0229811072349548,0.0049273958429694,40,1,39,0,-0.0225516129285097,0.56678307056427,0.3623397648334503,0.3149265050888061,-0.505221962928772,0.9736105799674988,-0.2760795354843139,0.1139309033751487,0.3792497515678406,-0.0306353345513343,0.4859043657779693
2023-09-01,presidente juez entenderlo sebastián piñera criticó boric,0.4797789752483368,0.4769190549850464,0.4797789752483368,0.0433020107448101,5,4,15,2,-0.2609358131885528,0.2212416678667068,1.4268215894699097,0.3257456123828888,0.044273242354393,-1.1126177310943604,-0.8479092121124268,-0.5465633273124695,0.1499419957399368,-0.0589482523500919,1.2363654375076294
2023-09-01,gabriel boric demuestra pésimo presidente unir alinearla mirada futuro dedica polarizarla generando ambiente encrispación típico populistas violentos radicales sectarios peligro estabilidad chile,0.9658008217811584,0.9658008217811584,0.0289932694286108,0.005205959547311,8,1,8,2,0.5095623135566711,0.4688038229942322,0.8643235564231873,0.4445079267024994,-0.3278984129428863,-0.2928365468978882,-0.3108184933662414,-0.2173475921154022,0.6243976354598999,0.5870226621627808,0.5385273098945618
2023-09-01,periodista izquierda fernando paulsen manda mierda gabriel boric,0.9163359999656676,0.9163359999656676,0.0691913142800331,0.0144726447761058,51,6,97,1,0.0231732130050659,0.9208726286888124,0.9479438662528992,0.4263608157634735,0.2056981176137924,-0.3711214065551758,-0.9078817367553712,0.0965655744075775,0.2900429368019104,-0.5295353531837463,0.8791504502296448
2023-09-01,jordi castell declaró votar presidente boric grandes arrepentimientos criticó gobierno,0.544465959072113,0.544465959072113,0.4122691750526428,0.0432648584246635,936,693,3361,74,-0.3125354945659637,0.1830760091543197,1.4521427154541016,0.0870021432638168,-0.0269718077033758,-0.3430406451225281,-0.5143839120864868,-0.7421928644180298,-0.0704296007752418,0.3638408482074737,1.0026724338531494
2023-09-01,tremendo apoyo expresidenta michelle bachelet presidente boric grande soa bachelet,0.8477356433868408,0.0232501681894063,0.1290141940116882,0.8477356433868408,504,33,1502,35,0.1212721839547157,-0.3533467054367065,1.3245964050292969,-0.0615710653364658,-0.1983602195978164,-0.3301739990711212,-0.3682461082935333,-0.3826581239700317,1.3865290880203247,0.5802948474884033,0.9551008343696594
2023-09-01,alcalde tras grave colisión biotren bus san pedro paz indolencia absoluta posible venga presidente boric detener tren propias manos insólito,0.9520156979560852,0.9520156979560852,0.0408248007297515,0.0071595814079046,12,7,83,1,0.686772882938385,-0.1448678970336914,1.1961017847061155,0.1049761548638343,-0.2770996391773224,-0.199292704463005,-0.4950079619884491,-0.6302153468132019,1.0678850412368774,0.3986683785915375,0.4864235818386078
2023-09-01,inhumanas palabras presidente boric concepción julio césar neme republicanos biobío ley usurpaciones democracia viva tellier rechazo jordi castell,0.922917664051056,0.922917664051056,0.0684506595134735,0.0086316540837287,33,8,62,2,-0.0309419427067041,0.0058905906043946,1.2210742235183716,0.2250900268554687,-0.8473769426345825,-0.0591806769371032,-0.2977239489555359,-0.3721902072429657,0.841394305229187,0.4955863952636719,0.7110134363174438
2023-09-01,presidente boric promulga do leyes seguridad pública incluyendo llamado carabineros retiro,0.5694263577461243,0.2230748534202575,0.5694263577461243,0.2074987739324569,4,3,13,0,0.4196340441703796,-0.024508262053132,1.439006805419922,0.0195701755583286,-0.5308440923690796,-0.4419259428977966,-0.5636885762214661,-0.389404684305191,1.0252419710159302,-0.5547420978546143,0.8336672186851501
2023-09-01,rueda prensa medios alternativos emisoras periódicos canales comunitarios construyendo democracia objetividad administración protagonistas incluso aquellos desacuerdos,0.7367052435874939,0.0805113315582275,0.7367052435874939,0.1827833652496338,2233,350,4633,53,0.0311341285705566,0.0011165812611579,0.8775782585144043,0.6487283706665039,0.4740736782550812,0.2912398874759674,-0.280844122171402,0.4417139589786529,0.2438844442367553,0.7007462978363037,0.2014575004577636
2023-09-01,presidente boric reunirá sebastián piñera viernes moneda,0.5468111038208008,0.1228726431727409,0.5468111038208008,0.3303163051605224,14,72,25,13,0.6436206698417664,-0.9506988525390624,1.7471822500228882,-0.1341875195503235,0.0515789799392223,-0.5376778841018677,-0.6977890729904175,-0.7724073529243469,1.6160192489624023,0.363637775182724,1.380206823348999
2023-09-01,presidente boric informe contraría relación acaso democracia viva comentan actos corrupción gobierno cercanos hacerse responsables aquello acá meter bajo alfombra vivo pluto tv yt,0.6914929747581482,0.6914929747581482,0.2870504856109619,0.0214565172791481,26,63,87,9,0.6594778895378113,0.7194506525993347,1.4542394876480105,0.2437403202056884,-0.1874862760305404,-0.0757317766547203,-0.1665135473012924,-0.1365917921066284,0.3627502918243408,0.1940568536520004,0.7392886281013489
2023-09-01,deterioro imagen boric rechazo boric alcanza casi resultados encuesta indican índice aprobación presidente chileno gabriel boric alcanzado desaprobación sitúa,0.7325971722602844,0.7325971722602844,0.2427014112472534,0.0247013978660106,4,2,16,0,0.3572483360767364,0.1650756299495697,1.4815952777862549,0.1356797963380813,-0.3615645468235016,-0.3126339614391327,-0.8707215785980225,-0.1838557571172714,0.7781228423118591,-0.6094335913658142,1.0347113609313965
2023-09-01,asesino violador ddhh sebastian piñera citado gabriel boric reunión moneda mono peludo ají culo,0.7532607316970825,0.7532607316970825,0.199208378791809,0.0475308708846569,9,3,16,2,0.2617178559303283,0.6746347546577454,0.5886356234550476,-0.1846291571855545,-0.0617681182920932,-0.4862196147441864,-0.82599276304245,-0.137291818857193,0.0327906981110572,-0.2915489375591278,0.9256370663642884
2023-09-01,bueno sepa manera clara categórica reacción presidente boric enterarse informe contraloría,0.6686316132545471,0.1069634556770324,0.6686316132545471,0.2244050204753875,20,84,40,31,0.1441621035337448,0.2484334707260131,1.0422955751419067,0.3731306791305542,0.3123809099197387,-0.4088201820850372,-0.4970966279506683,-0.203492060303688,0.8455265164375305,0.1718835830688476,0.6560032367706299
2023-09-01,presidente boric evalúa fórmulas levantar secreto valech marco años golpe,0.5720193982124329,0.2814956605434418,0.5720193982124329,0.1464849859476089,256,485,1343,275,0.1663595736026764,-0.0480892807245254,1.2585572004318235,0.2564557790756225,-0.4079078137874603,-0.4881370365619659,-0.5192930102348328,-0.6374561786651611,0.4212861657142639,-0.1372122168540954,0.8734970092773438
